Authors,Title,Year,Source title,Volume,Issue,Art. No.,Page start,Page end,Page count,Cited by,DOI,Link,ISSN,ISBN,CODEN,Document Type,Access Type,Source,EID
"Sanislav T., Cǎpǎţînǎ D., Guran A., Cojocar G., Stoian I.","An automated registration system of non-communicable chronic diseases cases based on multiagent approach",2010,"2010 IEEE International Conference on Automation, Quality and Testing, Robotics, AQTR 2010 - Proceedings","2",, 5520701,"386","391",,,10.1109/AQTR.2010.5520701,"https://www.scopus.com/inward/record.uri?eid=2-s2.0-77958602898&doi=10.1109%2fAQTR.2010.5520701&partnerID=40&md5=8b4bbdc7829f585ccab6967275b760a1",,9781424467259,,Conference Paper,,Scopus,2-s2.0-77958602898
"Niculescu V., Guran A.","Bounded parallelism in PowerList and ParList theories",2009,"SYNASC 2009 - 11th International Symposium on Symbolic and Numeric Algorithms for Scientific Computing",,, 5460844,"237","244",,1,10.1109/SYNASC.2009.30,"https://www.scopus.com/inward/record.uri?eid=2-s2.0-77953081013&doi=10.1109%2fSYNASC.2009.30&partnerID=40&md5=75dff8ce860c5cd9862681ff3f4c7a2a",,9780769539645,,Conference Paper,,Scopus,2-s2.0-77953081013
"Czibula I.G., Czibula G., Guran A.M.","Dynamic customization of data structures instances using an agent based approach",2009,"SYNASC 2009 - 11th International Symposium on Symbolic and Numeric Algorithms for Scientific Computing",,, 5460832,"341","347",,1,10.1109/SYNASC.2009.25,"https://www.scopus.com/inward/record.uri?eid=2-s2.0-77953056272&doi=10.1109%2fSYNASC.2009.25&partnerID=40&md5=1c5f4bd763494888f7e978e6893006b2",,9780769539645,,Conference Paper,,Scopus,2-s2.0-77953056272
"Czibula G., Guran A.-M., Czibula I.G., Cojocar G.S.","IPA - An intelligent personal assistant agent for task performance support",2009,"Proceedings - 2009 IEEE 5th International Conference on Intelligent Computer Communication and Processing, ICCP 2009",,, 5284791,"31","34",,8,10.1109/ICCP.2009.5284791,"https://www.scopus.com/inward/record.uri?eid=2-s2.0-74049083736&doi=10.1109%2fICCP.2009.5284791&partnerID=40&md5=77bd4f17c2fb12a5513b3cbf8c6f6f12",,9781424450077,,Conference Paper,,Scopus,2-s2.0-74049083736
"Pitariu H.D., Andrei D.M., Guran A.M.","Social research methods used in moving the traditional usability approach towards a user-centered design approach",2009,"International Journal of Information Technology and Web Engineering","4","4",,"36","53",,,10.4018/jitwe.2009100103,"https://www.scopus.com/inward/record.uri?eid=2-s2.0-76449112394&doi=10.4018%2fjitwe.2009100103&partnerID=40&md5=3f4d99b6e0c448d9eb6683761fd89ddd",15541045,,,Article,,Scopus,2-s2.0-76449112394
"Czibula G., Czibula I.G., Cojocar G.S., Guran A.M.","IMASC - An intelligent multiagent system for clinical decision support",2008,"Proc. - 2008 1st International Conference on Complexity and Intelligence of the Artificial and Natural Complex Systems. Medical Applications of the Complex Systems. Biomedical Computing, CANS 2008",,, 5231428,"185","190",,7,10.1109/CANS.2008.28,"https://www.scopus.com/inward/record.uri?eid=2-s2.0-70350554468&doi=10.1109%2fCANS.2008.28&partnerID=40&md5=d6f09a356ca7f2d6dfe795e239e27582",,9780769536217,,Conference Paper,,Scopus,2-s2.0-70350554468
"Czibula G., Guran A.M., Cojocar G.S., Czibula I.G.","Multiagent Decision Support Systems based on supervised learning",2008,"2008 IEEE International Conference on Automation, Quality and Testing, Robotics, AQTR 2008 - THETA 16th Edition - Proceedings","3",, 4588943,"353","358",,2,10.1109/AQTR.2008.4588943,"https://www.scopus.com/inward/record.uri?eid=2-s2.0-51949095115&doi=10.1109%2fAQTR.2008.4588943&partnerID=40&md5=06153c8a47d7372616298c9a99be66b6",,9781424425778,,Conference Paper,,Scopus,2-s2.0-51949095115
